<?xml version="1.0" encoding="UTF-8" ?>
<signatures version="2"
            xmlns:xsi="http://www.w3.org/2001/XMLSchema-instance"
            xsi:noNamespaceSchemaLocation="../../../overrides.xsd">

  <replace name="gl|glcore" version="4.5">
    <function name="MemoryBarrierByRegion">
      <param name="barriers"><type>MemoryBarrierRegionFlags</type></param>
    </function>
  </replace>

  <add name="gl|glcore" version="4.5">
    <enum name="MemoryBarrierRegionFlags">
      <use token="ATOMIC_COUNTER_BARRIER_BIT"/>
      <use token="FRAMEBUFFER_BARRIER_BIT"/>
      <use token="SHADER_IMAGE_ACCESS_BARRIER_BIT"/>
      <use token="TEXTURE_FETCH_BARRIER_BIT"/>
      <use token="UNIFORM_BARRIER_BIT"/>
      <use token="ALL_BARRIER_BITS"/>
    </enum>
  </add>

</signatures>
